user_name,user_rank,num_response,user_star,time,rating,content
ㅇㅅㅇ,8,7,4.9,2024.03.16.,5.0,특유의 분위기도 좋고 맛있는데 웨이팅 진짜 깁니다ㅜㅜ 평일에 가시는 거 추천드려요!
빵기록집,7,8,4.1,2024.02.17.,5.0,맛도리 미쳤다❤️너무 맛나게 잘 먹었습니다!간만에 홍대 맛집 성공🫶
JY,10,10,3.3,2024.02.12.,2.0,- 맛이 없진 않지만 기성품 맛입니다.- 웨이팅 엄청 오래 걸립니다. (매장 내 테이블 총 16개)- 대체로 친절하지 않은 분위기입니다. (물 달라고 말 안하면 안 줍니다)
지우개,4,11,4.1,2024.01.10.,4.0,
장소연,3,2,3.5,2024.01.07.,2.0,음식 너무 늦게 나옴;; 피자는 맛있었음
리노,13,151,5.0,2024.01.06.,5.0,
휘바휘바,9,12,4.3,2023.12.15.,4.0,분위기 독특해서 한번쯤 가볼만한 곳. 맛도 괜찮음
리나,8,23,4.9,2023.12.02.,5.0,언니항 같이 갔는데 맛있어요12.2)저번주에 또 갔다 왔는데 맛있었어요😋
♥아름♥,1,1,5.0,2023.11.17.,5.0,
HyeJung,2,2,1.0,2023.11.06.,1.0,맛없음
음식에진심인편,23,42,3.6,2023.11.01.,3.0,맛있고 컨셉 확실해서 보는 재미가 있었어요근데 파스타 양이 적어서 가성비 있지는 않았어요후기에 왜 다들 양이 많다 그러는지 모르겠어요 제가 하루에 한끼 많아야 두끼 먹는 소식좌인데.. 파스타랑 음료수 먹고 배부르게 먹기까지는 좀 부족하다 느꼈어요그래도 맛은 있었어요+) 10월 30일 경 혜화 마녀주방 가봤는데 퀄리티가 훨씬 좋음..  점바점이란게 이런 말이구나..
뭐야,13,23,3.5,2023.10.25.,5.0,너무 맛있어용! 음식이 너무 귀여움
미숙,2,3,3.3,2023.10.08.,3.0,
아기볶음밥,6,8,4.9,2023.09.26.,5.0,맛도 있고 분위기도 정말 최고였어요~ 다만 테이블간 거리가 너무 좁아서 진지한 이야기는 삼가하시는게...
ㅎㅁ,7,15,3.7,2023.09.11.,1.0,평점 조작하는 거 같은데 개별로임
전사의 긍지,34,234,4.1,2023.08.22.,4.0,Not bad~!
mjk,6,16,5.0,2023.08.17.,5.0,아이들데려오기 좋아요 양도많고 맛있어요
곽정원,19,21,4.0,2023.07.24.,5.0,분위기 특이하고 가성비 좋은 맛집. 비스마르크 피자 존맛에 논알콜 칵테일 링거는 국룰
허재준,2,4,5.0,2023.05.08.,5.0,
해피릴리,9,7,4.3,2023.05.05.,5.0,컨셉도 확실하고 음식도 맛있어서 두번째 방문인데 서울가면 또 가고 싶은 곳이에요~
만듀만듀,21,26,3.8,2023.04.10.,5.0,강남점 갔다가 음식에 반하고 홍대에서 자주 먹었던 양식맛집! 마녀주방 컨셉이 할로윈이랑 잘 맞아서 할로윈때 방문했는데 웨이팅줄이 어마어마하게 있었어요
리뷰,5,5,2.6,2023.02.02.,1.0,오후6시 근무서는 염색머리 여자 카운터싸가지가 왜이렇게 없나요?저번에 왔을 때도 싸가지 없었는데 여전히 없네요이 알바생 왜쓰나요?갈 때마다 웨이팅 5명 이내인데 1시간 반 걸린다고 합니다;손님 받기 싫어서 그러나요?오래 걸린다길래 멀리 가있으면 20분도 안되서 전화하고전화 금방 끊겨서 1분 지나서 바로 다시 전화하니까'전화 안 받으면 취소된다고 했잖아요'이렇게 말하네요?가고 있는데 안되냐 하니 다시 예약하라네요손님 있는데 핸드폰이나 쳐다보고 있고알바비 안 받는 거면 이해하겠습니다.
•_•,30,114,4.1,2023.01.09.,5.0,맛있어요
ELT,27,100,3.5,2022.12.25.,1.0,접객 좀 매너있게 해요. 밀키트같은 퀄리티 팔면서 쌍방 기본적인 건 좀 지킵시다.
맛집만 노리는 검은 복면,36,209,3.7,2022.09.21.,3.0,무난무난홍대 주변에 워낙 맛있는 파스타집이 많아서 여기 보다는 다른 데 갈 듯
소진용,22,112,4.6,2022.08.11.,4.0,양도 푸짐하고 맛있게 잘 먹었어요
2021년부터,41,355,2.8,2022.08.07.,5.0,토마토파스타가 매콤하니 맛있어요.
수빈,19,20,4.2,2022.08.05.,5.0,마녀 주방은 진짜 홍대점이다ㅜㅠ 3번 넘게 간 것 같은데 갈 때마다 맛있음ㅠㅠ
하현,11,10,4.7,2022.08.04.,4.0,맛은 무난하고 생각보다 양이 푸짐해서 놀랐어요. 사람이 많은 시간에는 대기해야해서 예약하는게 좋을 듯 해요.
임창준,22,63,3.2,2021.12.21.,1.0,옛날에 갔었는데 엄청 평범한 집이 컨셉질한다고 보시면 됩니다 주변이랑 비교하면 굳이 갈만하진 않아요2~3점 주려다 댓글알바 쓰는 것 같아서 1점 줌
🌙,16,31,4.5,2021.12.20.,4.0,음식도 맛있고 분위기나 인테리어도 가볍게 가기에 좋았어요!
희야,29,218,4.6,2021.11.05.,3.0,굿굿
왜갑자기나아이디다시만들어야하냐고아ㅡㅡ,24,88,3.1,2021.10.05.,5.0,생각보다 너무 마싯고 재미뜸
콩콩,25,105,4.1,2021.08.12.,3.0,"생각보다 저렴해서 가성비 좋은 곳. 음식 맛도 꽤 괜찮고, 여럿이서 나눠 먹고 사진 남기기 좋아요."
별별,26,178,4.5,2021.06.30.,3.0,그냥 저냥 ㅎㅎ
또로,3,2,3.5,2021.06.26.,2.0,아이들 놀이터로는 좋으나음식은... 좀저렴한가격같네여
.,13,29,2.7,2021.06.25.,2.0,달아요 그냥 모든게
쏘냐도르,43,362,4.3,2021.05.10.,3.0,맛: 대존맛은 아니지만 딱 가격만큼 먹을만함서비스: 직원분이 메뉴를 잘못갖다주길래 말하니까 그냥 주고 좀이따 원래시킨메뉴 또줌 ㅋㅋ 감사하긴한데 배터지는줄인테리어: 컨셉따라 아기자기하게 뭘 많이해놨더라고요기타: 친구들끼리나 여사친이랑 가볍게 가긴 좋은데 작정하고 분위기좋은곳은 아니구요. 약간 주 고객층 나이대가 어린 느낌? 아마 다시 갈일은 없을거같네요
김민지,2,1,5.0,2021.05.10.,5.0,"분위기도 이색적이고 독특하고, 음식 비주얼 맛 모두 넘넘 만족스러웠어요. 재방문했습니당^^"
기록용,16,30,4.2,2021.05.08.,5.0,나 포함 3명이서 도착했다. 저녁에 가니까 분위기 쥑인다.기억이 잘 안나는데로제파스타랑 토마토 리조또? 고구마 피자 이렇게 시키고 주스는 에이드로 했다. 한번 사이다나 콜라로 리필해주신다 함.가격 생각해보면~~ 그래도 맛있는 수준이었다.고구마피자만 그런건지 다 그런건진 몰라도 생각보다 파이지 식감과 맛이 난다. 아스러져 조금 난감. 그래도 달달하니 맛있었음. 거미모양 과자 귀엽다.알콜 함유된 무언가를 시키려면 자리의 모두가 성인이어야만.5명 이상일 시 따로 나눠 앉는다 하더라도 받지 않는다고.미리 전화해서 대기시간이 어느 정도일지 물어보고 괜찮겠다 싶으면 가서 대기 뽑아놓으세용점심에 먹으려고 했는데 대기 1시간이라서 저녁에 왔스..!인원수대로 음식 시켰는데 결국 배불러서 체함.
현지,4,3,5.0,2021.04.19.,5.0,너무 맛있었어요!!! 가격 진짜 저렴하구 굿굿
뽀,11,26,3.0,2021.04.11.,5.0,
전도연,5,3,5.0,2021.04.08.,5.0,맛있어요 굿굿
최현경,3,2,5.0,2021.03.21.,5.0,강남에 있는것도 맛있게 먹었는데~홍대까지 생겨서 넘넘 좋아요 !!역시 최고 ㅠ.ㅠ또 먹어도 진짜 나이스하네요 ~~
KIM TAEHEE,2,1,5.0,2021.01.21.,5.0,컨셉이 너무 좋은 곳이네요!분위기도 좋고 맛도 있고~
진영,2,2,5.0,2020.12.14.,5.0,"역시 믿고먹는 마녀주방 , 자체적으로 만족도 설문조사도 진행하면서 고객들의 니즈를 파악하는게 좋아보였습니다"
윤혜빈,3,2,4.5,2020.12.11.,4.0,컨셉도 확실하고 음식 맛 좋았어요
냠냐미,31,116,2.9,2020.11.21.,2.0,이 평점이 맞나 싶음10대들이 가면 좋아할 듯맛은 그저 그럼
연지,2,1,5.0,2020.11.16.,5.0,1년 내내 할로윈 분위기라 신선했어요 :) 음식도 저렴하고 푸짐한데 맛있어요!
마이쪄,28,76,3.3,2020.11.10.,2.0,재밌긴한데 음식이 싼티남. 이십대 초반이 좋아할듯
ㄱㅎㄱ,16,"1,121",5.0,2020.11.05.,5.0,
부메랑,5,8,4.3,2020.11.05.,5.0,분위기도 좋고 맛도 좋아용ㅎㅎ
icxtxx,24,159,4.5,2020.11.03.,4.0,컨셉 좋고 ㅎㅎ 좋아용 맛도 굿굿
단타,11,25,3.5,2020.10.30.,2.0,애매하게 찝찝하고 맛도 그닥인 이런컨셉 좋아하면 괜찮을지도
뇸,10,18,4.3,2020.10.09.,4.0,콘치즈피자가 개마시따
솔직하게,4,19,4.4,2020.10.07.,5.0,독특한분위기&맛있는음식
최은진,2,1,5.0,2020.09.21.,5.0,인테리어며 음식 비쥬얼이며 맛이며 다 완벽히 취향저격해버린 맛집 ♥︎
신세욱,3,4,4.5,2020.09.15.,4.0,인상적인 인테리어
김효진,2,1,5.0,2020.08.25.,5.0,재밌게 맛있게 친구랑 먹고왔네요! 할로윈컨셉 좋은것 같아요
경택,2,1,5.0,2020.08.20.,5.0,장말 맛있게 잘먹었습니다. 이색적인 분위기에서 맛난 음식이여서 기분좋게 먹었습니다
오스틴파워스,46,263,3.6,2020.08.09.,3.0,"링거 팩에서 내려지는 음료가 독특한 곳입니다. 개인적으로는 음식은 보통 수준이라고 생각합니다. 분위기는 독특하지만, 그 이상은 아니라고 평가합니다."
킴이맘,5,2,5.0,2020.08.02.,5.0,분위기 끝내줘요ㅎㅎ너무 맛있게 잘 먹었습니다^^가성비 좋아서 재방문의사200%에요!
👼,20,38,4.1,2020.07.08.,5.0,메뉴 다 맛있었어요. 리조또가 개인적으로 진짜 최애♡
한승희,2,2,5.0,2020.07.07.,5.0,제가 먹어본 리조또 중에 제일 맛있었습니다 ㅠ가격과 맛 둘다 만족입니다
유승희,5,3,5.0,2020.07.04.,5.0,마녀주방은 역시 존맛탱!!!대만족하고갑니다
연수인,2,1,5.0,2020.07.03.,5.0,"직원분들도 왕 친절하시고, 음식도 진짜 빨리 나오고 맛있어요! 특히 거미줄 고구마 피자... 꼭 드세요.. 제발.."
이민숙,2,1,5.0,2020.05.28.,5.0,피자 도우가 부드러운 부분은 부드럽고 바삭한 부분은 바삭해서 정말 맛있었어요. 위에 올라간 해골 계란후라이도 잘 어울렸습니다. 분위기도 어둡고 재밌고 직원 분들 친절하셔서 좋았어요☺️
현아,13,29,5.0,2020.05.15.,5.0,컨셉도 재밌고 직원분도 친절하시네요 ㅎㅎ가격이 저렴해서 맛은 기대 안했는데 비싼데보다 나아요. 파스타 피자 모두 만족합니다 ㅎㅎ
혜수,1,1,5.0,2020.05.01.,5.0,분위기 진짜 이쁘고 특이하고 넘 좋아요! 은은하고 데이트하기 딱 좋음 :)그리고 직원분들 및 사장님 넘 친절하셔서 식사하는 내내 기분이 좋더라구요음식들은 하나같이 다 특이한 플레이팅이 짱이뻐요...근데 맛은 놀라울정도로 존맛탱..이쁘고 맛도있는 마녀주방 대만족했습니다 또 방문하려구요!
최준열,2,1,5.0,2020.04.29.,5.0,최근갔던 맛집중 단연최고입니다. 맛도 맛있는데 많은 양에 가격까지 착한가격ㅎㅎ 거기에 이쁜 인테리어에 분위기까지 좋아 너무좋았고 자주가야겠어요 ^^
최성근,4,4,5.0,2020.04.28.,5.0,최고입니다. 최근에 갔던 맛집 중에 원탑이에요. 최고의 후기 사진은 남긴 음식 없이 다 먹은 사진이라 생각합니다. 그런 사진을 찍게 해준 마녀주방에게 감사할 정도이요.
minmiya,2,3,5.0,2020.04.28.,5.0,맛도 있지만 친절해서 좋았음
스타벅스,13,34,4.1,2020.01.17.,5.0,맛도 맛이지만 다 친절하십니다
🏖,37,196,4.0,2020.01.14.,4.0,알리오올리로는 그닥 이였는데 여기 김치볶음밥 맛집임사진찍기도 좋음
조윤서,4,3,2.3,2020.01.03.,5.0,개맛있음 양 조낸 마나 진짜............
최혜정,7,6,4.2,2019.12.26.,2.0,가봤는데 역시 이런 이색테마를 선보이는 레스토랑은 맛보다는 서비스와 꾸며진 내부..일까요 이런 편견을 깨줄곳이 나올까 했는데 역시나. 맛은 기대하지마세요 그렇지만 나머지는 다 좋았습니다
swan123456789,7,7,2.7,2019.07.30.,4.0,독특한 인테리어도 좋았고 느끼한거 별로 안좋아하는데도 맛있게 먹었다 가격이 조금 비싼게 흠? 전반적으로 만족
#,15,39,3.1,2019.06.13.,5.0,유명하고 비싼만큼 맛있어요!! 포테이토 피자는 너무 달긴 했지만 토마토 스파게티가 너무 제 취향이라 항상 즐겨먹어요♥ 이벤트도 많이하고 직원분들도 친절해서 갈때마다 만족합니당 :)
박승우,8,9,3.8,2019.01.30.,5.0,음식이야 유명한 만큼 이름 값을 하는것 같습니다.음식보다 서비스에서 더 크게 감동 받고 갑니다.직급은 잘 모르겠으나 ‘장현’ 명찰을 봤습니다. 웨이팅 때 물어본 없어진 메뉴를 식사 후 배웅해주시며 언급해 주시고 신경써주시는 모습이 감명 깊었습니다.저희 뿐만 아니라 다른 손님들에게도 웃으며 일하시는 모습이 정말 보기 좋았습니다. 앞으로도 다른 분들에게도 ‘마녀주방’이 좋은 기억으로 남게 해주시면 감사하겠습니다.
ㅇㅇ,14,35,4.3,2019.01.23.,4.0,인테리어가 예쁘다. 직원분들이 친절하시다. 그런데 음식 가격이 좀 비싸고 전체적으로 너무 느끼하다.
