user_name,user_rank,num_response,user_star,time,rating,content
MZ식객,5,47,3.2,2024.04.23.,3.0,
노병수,9,14,2.9,2024.04.11.,1.0,음식이 맛있어서 재방문 했는데너무 불친절한 응대를 받아서 그냥 나왔습니다당신의 불친절이 누군가의 하루를 망칠 수 있다는 걸 명심하세요 반드시 돌려받을 겁니다.
헤일로2600,16,20,4.1,2024.04.08.,5.0,카레들도 다 개성있고 아보카도 냉우동도 소스랑 야채랑 잘어울려서 맛있었어요 냉우동은 비빔우동이고 카레는 에비가 제일부드럽고 맛있네요생각보다 양이많았어요
.,13,17,3.6,2024.04.03.,1.0,사장님이 너무 불친절:;;;;;;;;; 다른지점이 더맛있음
방참우,31,73,4.0,2024.04.03.,5.0,카레가 이렇게 맛있는 음식이었다니...
업살녹,2,3,5.0,2024.04.03.,5.0,"반반카레:13000밥 양이 좀 적다 생각했는데 밥은 물론 카레도 무료로 추가 가능했습니다! (몇 번까지 해주시는지는 모름) 에비카레는 조금 달달하고 가벼운 맛?이 없지 않아 있었지만 맵지 않은 카레는 보통 다 그러니까요 ㅎㅎ. 그래도 토리카레는 묵직하고 깊은 맛이 좋았습니다.카레뿐만 아니라 카레에 들어가는 후레이크, 새우, 고기 건더기까지 신경 써서 만드신 게 느껴지는 맛이었습니다. 맛은 8.5/10 지만 종업원분들이 친절하셔서 더 맛있게 먹었던 것 같습니다."
영,5,112,3.2,2024.03.24.,4.0,
치,3,14,4.5,2024.02.24.,4.0,
객관적인리뷰어,22,40,3.5,2024.02.24.,3.0,카레랑 돈가스 먹었는데 음식이 약간 식어서 나왔고 그렇게까지 맛있는 것도 아니었네요.. 별점이 높아서 기대하고 왔는데 아쉽네요ㅠ
won,21,29,4.9,2024.02.16.,5.0,"맛있어요. 사실 비쥬얼에 끌려서 온거라 맛은 별로 기대 안하고 평타만 치면 좋겠다 생각했는데. 연어도 맛있고 특히 소스들이👍소코아 카레는 다양하게 먹을수 있어서 좋았고, 세가지 다 맛있었어요. 아보카도 연어냉우동도 연어 비리지 않고 맛있었고,소코동 위의 크림소스가 고기랑 정말 잘 어울리더라구요. 아 그리고 매실토마토에이드랑 복숭아 소다도 시켰는데 둘 다 괜찮았어요. 둘 중엔 매실 토마토 에이드가 더 맛있더라구요. 토마토가 들어가서 이상할줄 알았는데 의외로 잘 어울려서 만족 ㅋㅋ"
밥먹자곽춘배,7,6,3.7,2024.01.31.,5.0,새우 아보카도 냉우동 먹엇는데 새콤달콤 맛있었고 아보카도가 고소하고 후숙잘돼서 넘 잘어울렷어요 일행 카레도 뺏어먹었는데 카레가진 짜…. 달짝지근하고 너무…너무너무너무맛있어서 카레 시킬걸 햇네요 다음에 갈때는 카레먹으로가고싶어요 ㅎㅎ
izro,22,34,4.6,2024.01.27.,5.0,아주아주 존맛인데 다음에 비프 냉우동 꼭 먹는다!!! 재료소진 너무 아쉬와요 ㅠㅅㅠ
다람쥐맨,12,21,4.0,2024.01.06.,4.0,전반적으로 맛있는데어느날 저녁에 갔더니 밥이 푸석푸석..운 좋은 날 가세요
.,18,21,3.7,2024.01.05.,5.0,"말해뭐해.. 리필도 해주고 맛도 짱, 친절에, 가성비까지 구우우우웃"
bang*2,5,8,4.1,2023.12.27.,4.0,맛있는 일본시카레. 웨이팅 조금 있음
민또,2,1,5.0,2023.12.26.,5.0,소코동을 시켰는데 크림과 같이 먹는 게 특이하고 맛있습니다. 그리고 특히 !!!!!! 카레가 너무 맛있네요. 카레 먹으러 또 오고 싶어요. 노래도 잔잔하게 좋고 친절하셔서 기분 좋은 식사였습니다.
왹왹,2,3,5.0,2023.12.13.,5.0,
,2,65,4.4,2023.12.09.,4.0,
힌재,39,114,3.5,2023.12.03.,3.0,"밥이 좀 말라 있었고, 에비카레가 너무 가벼운 맛이었습니다. 기본 카레에 물이랑 설탕 탄 맛. 깊은 맛 없이 달기만 해서 밥이랑도 안 어울리는 느낌이었어요.드라이 카레는 맛도 진하고 밥이랑 잘 어울렸어요. 커리 향이며 고기 향까지 묵직한 게 딱 제 취향. 다시 방문한다면 이것만 먹을 거 같네요."
Rae,32,117,4.2,2023.11.27.,4.0,
극단적 리뷰러,5,15,3.4,2023.11.05.,5.0,주말 저녁 직원 분들이 친절하시고 맛있어요
9,4,4,4.8,2023.11.05.,4.0,
코미누나,6,11,4.2,2023.09.29.,4.0,☆☆에비카레☆☆ 진짜 맛나요 리필도 함!!!
굴자,27,85,3.6,2023.09.27.,4.0,아보카도 연어 생우동이 맛있었습니다. 소스는 고마소스를 활용하신 것 같았는데 적당한 퓨전 일식 느낌이라 괜찮았습니다
하이,11,12,3.3,2023.09.21.,5.0,"마제소바는 처음 먹어보는데 정말 맛있었고,직원분들이 친절해서 다시 오고싶은 곳 !!🤤특히 일하시는 분들 중에서 젊은 여자직원분이조심스럽게 오셔서 밥이나 카레 부족하지는 않은지 물어봐주는것도 넘 감사했음 ,,♥️"
kaory,19,29,3.5,2023.09.08.,3.0,일단 가게는 아기자기 이쁘고 분위기는 좋음 카레는 맛있는데 밥이 너무 딱딱해요 나도 고두밥 좋아하는데 여긴 음 차갑고 너무 꼬들해서 좀 아쉬웠네요 동나마 안남미가 더 낫다는 생각까지(죄송^^;;) 그 흔한  장국까지 없어서 더 안넘어 가는듯요 다만 밥과카레가 리필이 되니 대식가는 좋을듯요
TY kim,4,18,3.6,2023.09.03.,5.0,
도깨비,2,1,5.0,2023.08.16.,5.0,지나갈때마다 맨날 줄서있길래 궁금해서 뭐 파는지도 모르고 들어갔다가 반했어요 카레 진짜 향긋하고 부드럽고 맛있네요 혼자 가도 정성 담긴 플레이팅과 직원분들의 친절함도 재방문 의사 포인트
별의커비,16,24,4.0,2023.08.13.,4.0,카레 존맛탱 보드라운게 처음 보는 맛이어서 맛났음 체인점이라고 하니 주변에 생기면 또 갈듯 근데 이걸 위해 홍대는 좀
냠,30,56,3.9,2023.08.12.,3.0,카레는 맛있는데 밥은 살짝 말라있어서 그게 좀 아쉬웠어요!
ㅇㅈ,5,5,4.6,2023.08.09.,5.0,카레가 정말 맛있고 분위기도 좋아서 홍대갈때마다 생각나는 식당입니다
김철,23,87,4.9,2023.07.31.,4.0,플레이팅도 예쁘고 맛은 훨씬 좋아서 마음에 쏙 들었네요 많이 파세용
Selly,37,74,4.4,2023.07.30.,5.0,카레 돈까스 분위기도 아기자기하고 주문한 메뉴도 다 맛있었어요특히 소코아 카레 너무 좋았어요
박장군,21,65,5.0,2023.07.28.,5.0,여러분 소코아 치즈카츠 치즈 늘어나는 거 장난 아닙니다~!! 그리고 수제 에이드 꼭 같이 드세요!! 그리고 카레 리필 2번 드세요(속닥) ㅎㅎ
이영석,24,94,4.9,2023.07.28.,4.0,"치치카 새로 나온 맛도리~! 폭신한 닭 안심에 치즈가 촤르르르~ 같이 먹는 양파랑 타르타르가 신의 한수임~ 치킨 같기도 하고 돈까스 같기도 하고, 굉장히 맛있어요.. 결론적으론 굿초이스👍"
김고현,19,64,4.9,2023.07.28.,5.0,"나만의 맛집 소코아라고 생각했는데, 신메뉴 나와서 더 유명해졌나 봄!! 신메뉴 생각했던대로 너무 맛있었음!! 소코아 카레에 냉우동, 치치카 하나 먹으면 끝임!!"
오세훈,21,75,4.9,2023.07.27.,4.0,"주말에 남친이랑 어디갈까 검색 많이 하는데, 일본감성의 식당이 있다고 해서 찾아왔어요! 시그니처 메뉴인 소코아 카레는 3가지 맛 모두 다 맛볼 수 있어서 좋코요, 매장 분위기가 너무 예뻐서 여행온 것 같다고 남친이 좋아하네요~ 친구들한테도 사진 보내줬는데, 이쁘다고 난리네요~~"
김사랑,21,75,4.8,2023.07.27.,4.0,"감성 ㅌㅓ지는 매장분위기에, 하나하나 ㄷㅏ 맛있는 일본식 메뉴에 소코아에 빠져들었습니다~! 마치 일본에 와있는 느낌 들어서 너무 좋구요, 감성 터집니다!! 어디에도 본적 없는 메뉴는 색다른 느낌을 줘요~ 웨이팅 쪼끔 있었는데 은근히 빨리 빠지더라구요~! 메뉴판 보면서 기다리다 보면 어느새 일본 도착입니다 ^,^"
심신서,24,103,5.0,2023.07.27.,5.0,귀엽게 생긴 메뉴판이랑 똑같이 생긴 메뉴가 맛도 너무 있어서 최근 간 식당 중 최고갑입니다!! 다른 곳에서는 볼 수 없던 특이하고 예쁜 메뉴라서 특별함이 더해졌습니다. 카레 리필되는 부분 너무 좋았어요!! 강추해요~!~
김정현,22,75,4.9,2023.07.26.,4.0,"아이들과 함께 갈만한 식당이 많지 않은데, 소코아는 정말 메뉴도 맛있고 직원분들도 친절해서 넘 맘에드네요~ 아이랑 함께 앉아도 넉넉하고 편안한 좌석이라 우리 가족 외식장소는 늘 소코아에요!!"
김희라,21,74,5.0,2023.07.26.,5.0,최애식당 소코아! 주말에 다녀왔는데 같이 간 친구들도 메뉴 모두모두 너무 맛있다고해서 데려간 기쁨이 있었어요 ㅎ 매장 인테리어 너무 ㅇㅣ쁘고 깔끔하고 감성적이라 더욱 마음에 들었어요~
김승용,22,81,4.9,2023.07.26.,5.0,"소코아 맛있어서 많이 다녔는데, 새로운 메뉴가 등장했다 싶어서 당장 이거다 싶어 먹어봤어요!! 근데 치치카! 이름도 뭔가 귀엽고 안에 치즈가 듬뿍 들어있어서 너무 맛있게 먹었어요~ 흔하지 않은 메뉴라 더 자주오게 될 것 같아요 소코아!"
수빈,3,1,5.0,2023.07.25.,5.0,직원분들 너무너무 친절하시고 음식도 맛있어욤ㅎㅎ 먹고 나오면 기분 좋아지는 맛집🫶🏻🫶🏻
Jeong Solhee,6,4,4.0,2023.07.24.,5.0,직원분들친절하고 음식 깔끔정갈해서 자주 찾는곳이에요~
진규 주,2,1,5.0,2023.07.23.,5.0,데이트 장소로 좋고 편안한 분위기와 직원분 친절하셔서 좋았어요 카레 소스 리필이 되니까 양 걱정도 없고 충분히 배부르고 맛있어서 잘 먹었씁니다.
수영,3,2,5.0,2023.07.20.,5.0,엄청 더운 날에 우선 차가운 물부터 주셔서 너무 감사했어요직원 분들 다들 친절 하시고 치킨가스와 카레를 먹었는데 다 맛있더라구요양이 모자르면 카레와 밥을 더 주신다는데 저희는 양이 충분해서 리필하지 않았답니다맛있는데 사진찍기듀 이쁘고 잘 먹었습니다
헉헉,38,198,4.3,2023.07.06.,5.0,소코아를 어쩌다 알게돼서 이런 사랑을 하게됐는지..
뚜찌빠찌,31,107,3.8,2023.06.24.,4.0,아보카도와 연어가 많이 있는것 같지는 않아요~~샐러드 먹는 느낌입니다!
무무,33,296,4.5,2023.06.18.,5.0,
호호 할범,33,388,4.1,2023.06.11.,4.0,:D
고아라,14,73,3.6,2023.05.26.,4.0,
군침도는곳만가는루피,14,77,4.4,2023.05.17.,5.0,
연근튀김,41,203,4.0,2023.05.13.,5.0,직원분들이 자리 안내도 잘해주시고 굉장히 친절해요카레 맛있어요 역시 실망시키지 않네요
박여원,21,54,3.9,2023.05.12.,5.0,
용감한이슬이,5,4,4.0,2023.05.08.,5.0,카레가 너무 맛있어요
ㅎㄹ,11,10,4.6,2023.05.04.,5.0,소코아 광주의 모든 지점을 다 가봤는데요~~ 홍대 소코아 맛있습니당ㅎㅎ 광주분들 안심하고 가셔도 됩니닷
맛있는 건 정말 못 참아~,27,93,4.0,2023.05.02.,4.0,소코아카레랑 아보카도연어냉우동을 먹었다. 웨이팅이 약간 있다. 카레는 무난하게 맛있고 냉우동은 새콤하면서도 참깨드레싱인지 고소해서 입맛 없는 여름에 먹으면 좋을 것 같다. 리필도 되고 괜찮지만 크게 특색이 있지는 않아서 한 번 가본 걸로 만족…!
250,14,32,4.0,2023.04.28.,5.0,진짜 맛있어요카레  무한리필이 최고장점
Audrey,2,1,5.0,2023.04.18.,5.0,
Cino,11,39,3.9,2023.03.27.,4.0,두번째 방문인데 맛있고 분위기도 좋았습니다!다만 직원분들이 참.. 바쁘신지 자꾸 주문누락이ㅜ리필도 누락인지 너무 안나와서 그냥 왔어요
오승열공,30,156,4.8,2023.03.18.,5.0,웨이팅이 조금 있다. 직원들은 친절하고카레는 리필해준다맛집 인정! 즐거운 추억을 담는다
박지민,5,2,5.0,2023.03.09.,5.0,맛잇고 직원분들도 친절하지만 이동네 건물들이 다 그렇듯 화장실이 음산하기 짝이없네요 마치 1920년대 프랑스 파리 동쪽 구석에 사는 실패한 아편중독 예술가의 작업실 겸 생활공간의 화장실에 들린 기분이였습니다 하지만 더럽진 않아요 그냥 우울해질뿐
봄,14,17,4.4,2023.03.08.,4.0,맛있는데 가격에 비해 양이 좀 적은듯
Pauline,12,13,3.3,2023.02.01.,5.0,"Small and stylish restaurantThe food was delicious and they had quite a few items on the menu.Unfortunately, they don't have an English menu and it's quite hard to understand what the different dishes are made of (even for my Korean friend)."
ridin,4,6,4.7,2023.02.01.,4.0,
이강희,21,36,4.3,2023.02.01.,5.0,언제나 꾸준하게 맛난 카레집! 다인석이 부족하지만 4명 아래는 회전율도 좋아요
.,13,42,4.4,2023.01.05.,4.0,
노점식,3,3,4.0,2022.12.27.,5.0,"밥을 마시게 되는 곳.. 에비카레가 밀키한 것이,, 하나도 안 느끼하네요.. 술술술.. 어랏 리필할까 하다가 막상 다 먹으면 딱딱 배부른 그런 곳 ^^.. 추천합니다"
따뜻한개소리,37,285,3.3,2022.12.12.,5.0,"맛있고 친절하고 분위기 좋음. 국물도 맛있고 카레도 맛있고 밥도 맛있음. 카레, 밥 리필 가능"
효미💙,2,88,3.3,2022.11.24.,4.0,
han,32,128,4.9,2022.11.19.,5.0,맛있고 친절해서 좋았어요
ㅇㅅㅇ,2,4,3.0,2022.11.17.,5.0,
육이삼,19,54,3.7,2022.10.31.,5.0,"친절하시고 음식도 맛있어요냉우동이랑 비빔우동중에 고민하다가 비빔으로 시켰는데, 조금 매콤한? 덜느끼한? 마제소바맛이에요 카레도 이쁘게 담겨오고 맛있네용 밥 더 필요하면 더 가져다 주겠다고 하시고 좋아요~~"
밥 먹는 햄,46,355,3.7,2022.10.29.,4.0,
내돈내산,6,5,4.4,2022.09.25.,5.0,비쥬얼 맛집인줄 알았는데 세상에 카레 대존맛리필도 되네요 심지어 또올게요
바삭이,26,64,4.5,2022.09.25.,5.0,너무 맛있어요ㅜㅜ 어떤 메뉴건 실패한 적이 없음.. 메뉴판에 한정메뉴가 몇개 있는데 마스킹테이프로 이름이 가려져 있어서 ?!벌써품절인가?하고 헷갈릴 때가 있어요.
나 무서운사람,4,53,4.2,2022.09.21.,4.0,
맛집콜렉터,15,18,4.2,2022.09.09.,5.0,"세상에, 너무 맛있네요. 사실 비주얼만보고 사진찍기 좋은 메뉴라고만 생각했는데 보기보다 훨씬 더 맛있습니다. 냉우동은 모두 아보카도가 들어간 메뉴뿐이라 조금 아쉬웠지만 사이드메뉴까지 완벽한 집은 너무 오랜만에 봐서 재방문 의사 백프로예요!"
솔직하게 말하자면,37,202,3.5,2022.08.16.,5.0,맛있다!
냠,3,4,4.0,2022.08.15.,5.0,너~~~~~ 무 맛있습니다 ♡
신준호,2,1,5.0,2022.08.14.,5.0,
쩝쩝학사,57,223,4.8,2022.07.31.,5.0,
김혜서,2,1,5.0,2022.07.21.,5.0,
정은,9,15,4.3,2022.06.30.,5.0,너무 맛있어요...ㅠ
고독한 미식가,11,14,4.4,2022.06.09.,1.0,
szredrec,14,52,4.1,2022.06.03.,5.0,너무 맛있게 잘 먹었어요! 직원분들도 완전 친절해요!!^~^
불고기로제,2,1,5.0,2022.05.05.,5.0,좋아하는 가게인데 식기가 나무인 점이 아쉬워요나무식기만 아니면 더 자주 갈 텐데...
김도영,7,10,3.0,2022.04.19.,5.0,마제우동이랑 에비산도 드셔보시면 이 점수가 납득이 갑니다진짜 존맛나만알고싶은 맛집
456,25,76,4.5,2022.04.18.,5.0,완전 또/라이 개존맛
째리,14,35,4.2,2022.04.10.,5.0,안유명해져서 나만 가고싶은 맛집
예림,6,2,5.0,2022.03.24.,5.0,진짜 맛있어요!! 홍대 소코아 존맛!ㅠㅠㅠ
죨,10,8,4.3,2022.03.01.,5.0,단골입니다
주바링,44,211,3.9,2022.02.22.,2.0,시그니처카레는 밥이 조금 차가웠지만 사이드로 시킨 고로케와 산도가 아주 맛있었습니다
ggy,34,98,4.4,2022.01.26.,4.0,맛있었어요 ! 카레가 엄청 부드러워요.주말에 가면 웨이팅 있을 가능성이 큽니다.
유지선,2,16,5.0,2022.01.15.,5.0,요즘시대 시국에 맛도리
안녕하세요,21,168,3.9,2022.01.14.,2.0,
김동현,6,4,3.8,2021.12.24.,5.0,매운카레가 말도안되게 맛있어서 여러번 가게되네요. 9000원은 좀 비싼 것 같지만 리필도 되서 괜찮은 것 같습니다. 직원분들도 하나같이 다 친절하시고 가게도 이쁘고 깔끔해요
욜로리리리,18,38,4.8,2021.11.05.,5.0,맛있어요 ٩( ᐛ )و직원분 말씀대로 비벼먹지 않고 고기와 하얀소스?랑 와사비해서 같이 먹으니까 더 맛있어요.친구가 먹은 냉우동도 상큼하고 맛있었어요여름에 먹기 딱 좋은 메뉴!음식도 맛있고 인테리어도 원목이라 따뜻한느낌이라서 개인적으로 좋았어요.직원분들도 친절해서 나중에 또 갈려고요.
내챔,29,292,3.2,2021.10.21.,3.0,
오발탄,13,25,4.2,2021.08.19.,5.0,가격대가 좀 있지만 직원분들이 매우 친절하세요
🌻,9,25,4.3,2021.06.24.,4.0,마제소바 먹었음맛있다밥시간대 웨이팅 있음
김밥,32,128,4.3,2021.06.14.,4.0,"부드럽고 맛있습니다. 근방 카레집 중에서는 베스트 안에 들어요. 가격대가 좀 있지만 카레, 밥을 리필해주셔서 괜찮은듯. 다만 비빔우동은 향이 강하고 좀 짜기도 하고.. 나중에 물리기까지 함. 후회하는 메뉴."
치즈토끼,33,259,4.4,2021.05.31.,5.0,조명이 분위기있고 냉우동도 맛있음!
인절미,11,9,4.8,2021.05.08.,5.0,냉우동이랑 저 노란색 카레를 꼭 먹어야 해요 너무 맛있어요
슈크림도어,23,37,3.7,2021.05.03.,4.0,맛있어용
센,13,16,3.9,2021.03.28.,5.0,진짜 너무 맛있었어요! 직원분들도 친절하시고 다음에 또 가고 싶은 맛이에여
좋은장소를찾아서,22,35,4.1,2021.03.06.,4.0,맛있어요 ~!!카레는 그냥 그랬던 것 같은데 냉우동이 맛있네용
손T,8,8,4.6,2021.02.02.,4.0,진짜 맛있어요..담에 또 갈거에요!!! 근데 연어샐러드 연어가 조금 비린맛이나서 별하나 뺐어요ㅎㅎ 그래듀 맛나게 먹었답니당
희현,5,3,5.0,2021.01.10.,5.0,
조조성환타맛,5,10,4.2,2020.11.06.,5.0,
jjjj,31,92,3.7,2020.10.29.,5.0,평점이 높은데는 다 이유가 있네요ㅎㅎㅎ가게가 아기자기하고 직원들도 아주 친절하셔서 기분좋게 식사하고 나올 수 있었어요~그리고 여태까지 먹은 카레 중 제일 맛있었어요ㅎㅎ연어샐러드냉우동도 양 괜찮고 맛있었어요ㅎㅎ밥이랑 카레 리필도 되어서 너무 좋아요~~~
정예림,16,25,4.2,2020.09.28.,5.0,맛좋고 서비스좋고 분위기 좋고안갈 이유가 음슴!
미식가,23,57,4.2,2020.09.24.,5.0,카레원래 싫어하는데 마제카레면 진짜 짱이에여 알바생분도 너무 친절하시요ㅠㅠ 고구마치즈고로케도 꿀맛
Kiera youn,24,54,3.2,2020.09.16.,4.0,소코아 사랑해 ! 연어아보카도냉우동 그거 하나먹으러 충분히 갈만하다
EJ,23,49,4.1,2020.09.09.,5.0,분위기 아늑하고 좋고 카레도 맛있어요! 밥이랑 카레 모두 리필해줘서 양도 넉넉하고 좋았어요~~
솔직한리뷰만,14,15,3.4,2020.08.15.,4.0,2번 방문했는데 모두 맛있게 먹었어요밥이랑 카레 모두 리필되고 깔끔해요!집이랑 좀 더 가까웠더라면 정말 자주 방문했을 식당입니다.:)카레는 레시피 배워서 집에서 계속 해먹고 싶을 정도로 맛있는데 밥 상태가 조금 아쉬워서 4점 드립니다. 쌀을 조금만 더 좋은 거 쓰시면 좋을 것 같아요!
난나랄라라,25,185,4.0,2020.08.01.,5.0,카레가 참 맛있어요b
🙈,16,59,2.0,2020.04.30.,1.0,최악의 밥상태
하른,11,13,4.0,2020.03.09.,5.0,맛있고 가게 예쁘고 친절하세요! 밥과 카레가 한번 리필된다는것도 장점인것 같네요!
먹기위해사는사람,61,854,3.3,2020.02.22.,4.0,새콤달콤한 소스를 과하게 써서 그저그런 연어 질을 가리는 듯한 느낌이 들었음.그래도 다음에 또 오면 에비카레랑 아보카도 냉우동 먹어보고싶긴함.+에비카레가 연어동보다 맛있다. 연어동 별 3개 에비카레 별 4개.
ㅇㅅㅇ,35,724,4.0,2020.01.31.,5.0,존맛탱
세상에,25,91,4.0,2020.01.28.,5.0,아보카도 에비 냉우동 죤맛~~~~~~~~ 갈 때마다 이거 먹음 카레도 너무 맛있음 식기도 너무 정갈하고 예뻐요
카투,16,40,5.0,2020.01.17.,5.0,지금까지먹은 연어덮밥중에 최고였어요너무맛있어서 친구들 데리고 한번 더 갔는데카레도 다들맛있다고 !! 쭉 항상 같은 맛이길 빌어봅니당
부넝,27,86,3.4,2020.01.02.,5.0,조오오온맛!!! 아보카도냉우동 꼭 시키세요!! 카레도 다 맛있었는데 갠적으로 에비카레가 젤 맛있고 카레 모자를까봐 따로 카레도 더 주시고 친절하셨어요ㅠㅠ
진실된평가,30,85,4.1,2019.11.02.,5.0,맛있어요! 에비카레 먹었고 9000원입니다. 고소한 크림베이스 카레에 향이 좋은 새우 몇조각이 곁들여져있어요. 새우양은 많지는 않지만 굉장히 맛있습니다. 그리고 이집의 가장 큰 장점은 밥입니다. 밥알이 찰지다못해 쫄깃쫄깃하네요. 밥양은 적어요. 소식가가 아닌이상 부족할겁니다. 그런데 한번 리필 가능하시니 참고하세요. 리필까지하면 배부릅니당!
