user_name,user_rank,num_response,user_star,time,rating,content
늘,31,117,4.1,2024.04.11.,5.0,매쉬드포테이토가 살짝 쫀득하면서 부드럽고 진짜 맛있네요. 살짝 느끼할때쯤 양파피클 먹으니 딱 좋아요.스프라이트 제로만 음료에 추가 되었으면 좋겠어요.다른데 수제버거 못먹겠네...특히 집근처 수제버거 체인점이랑 너무 비교되네... 가격이 싼건 아닌데 가성비 있다고 느낄정도로 맛있고 서비스도 좋아요.5.2.두번째 방문.베이컨치즈가 포테이토보다 먹기 편함.
독고한 미식가,12,23,3.9,2024.03.13.,2.0,맛 없었어요 기름이 많은 음식은 기본적으로 엄청 맛있어야 된다 생각하는데 소스도 잘 안어울리고 느끼하기만 했습니다
ㄹㅇ루다가,31,105,3.5,2024.02.12.,4.0,매쉬드포테이토 버거 먹었구 타 수제버거와 비교하여 엄청 자극적이지 않은 맛이라 되게 술술 들어가는느낌?? 매쉬드포테이토도 부드럽고 맛잇어요 갈릭감튀는 자극적인데 꿀맛. 벅벅이랑 비교하면 임팩트는 덜한데 덜 부담스러움딱하나 아쉬운점은 먹기가 불편하고 매쉬드포테이토의 포테이토밀도가 어딘 높고 어디는 낮아요
맛집일까요 아닐까요,13,14,3.1,2024.02.07.,2.0,"평일에 가서 웨이팅 없었어요!수제버거 처음 먹어보는데느끼해서 다 못 먹었어요버거는 버거킹 불고기 와퍼가 더 맛있는 거 같아요,,갈릭 감자튀김은 소스가 뿌려졌는데 바삭하고 맛있었습니다!갈릭 감튀 추천!장사의신 보고 멀리서 찾아간 건데 아쉬웠습니다.근처에 사시는 분들은 괜찮을 거 같아요"
ㅇㅇ,3,5,4.2,2024.02.07.,5.0,처음에는 평범한 느낌이였는데 집에 오니까또 먹고싶다...
임영호,2,1,5.0,2024.02.05.,5.0,햄버거를 좋아하지 않지만 우연히 들린집인데 괜찬네요 맛잇습니다 ㅎㅎ ^^
노맛은 죄악,8,12,4.1,2024.02.03.,5.0,굿
미식가,4,2,4.0,2024.01.29.,3.0,맛은 무난해요. 매쉬드는 수제버거에 감자샐러드 들어간 맛이에요. 좀 싱겁다는 느낌이 있을수도 있어요. 다만 사장님이 일을 잘 못하시는 느낌입니다. 음식이 여러 테이블에 한번에 나옵니다. 그러다보니 한번에 손님이 빠지고 한번에 다 들어와요. 타이밍 안맞으면 오래 기다려야돼요. 또 오래 기다리다보면 이렇게까지 기다리면서 먹을건 아닌거 같다 라는 생각이 듭니다. 타이밍 맞아서 바로 먹으면 괜찮은데 오래 웨이팅하면서 먹기엔 무난해요.그리고 사장님 오픈 주방인데 안에서 옷 벗고 입고 그러면 먼지 날리지 않을까요..?
원범,28,85,3.1,2024.01.13.,5.0,"가게내에는 음식냄새가 안빠져나가서 문을 열어서 환기시켯구  음식맛은 엄청 훌륭햇습니다 잘먹엇습니다 매쉬드버거. 베이컨치즈버거, 치즈프라이"
.,17,31,4.0,2024.01.08.,4.0,이제까지 다녔던 모든 수제버거 집 중에 원탑.갈릭불고기버거 처음 먹었을 때 충격 먹었음.가격은 살짝 아쉽.(추가) 아니 저때도 가격이 아쉬웠는데 가격이 또 올랐네....
이현지,21,41,4.6,2023.12.14.,5.0,진짜 레전드 남자친구랑 5분컷 냈어요.수제버거 많이 먹어봤는데 원탑이에요빵도 맛있고 육향 미쳐써요치즈감자 쥔차 돌아버림통새우버거랑 갈릭불고기 먹었는데새우 탱글 매콤 미친맛갈릭불고기 육향 쩔어요 미친미친! 아직 밖에 안 나갔는데 또오고싶어요;;
냥냥섬,8,9,4.9,2023.12.06.,5.0,싸고 양많고 맛있어요!!근데 아주 쪼끔 느끼했어요재방문의사가 있습니다
Aaron,27,148,2.5,2023.12.05.,3.0,치즈버거 기준마요네즈(?) 소스가 강해서 맛이 언밸런스양이 좀 적다
음,22,50,2.0,2023.12.01.,5.0,
오늘,11,30,4.2,2023.12.01.,5.0,
현,24,87,2.7,2023.11.27.,5.0,저 별다섯개 잘 안줍니다.
신한결,2,1,5.0,2023.11.06.,5.0,맛있어요! 장사의 신 솔루션 받은 이유가 있네요
말 많은 사람,33,122,4.1,2023.11.04.,5.0,지금까지 먹었던 수제버거 중 최고바닥이 미끄러웠던거 빼고는 완벽한 곳
Harn,22,32,4.0,2023.10.26.,5.0,맛있습니다. 깔끔하고 괜찮습니다.괜찮은 수제버거고 근처 오면 한번 가볼만한 집입니다.
꼬부기,3,11,3.6,2023.10.25.,4.0,
ㄹ,6,5,3.4,2023.10.21.,5.0,반 년전부터 꼭 가야지 하다가 오늘에야 와서 갈릭 불고기 버거랑 매쉬드 포테이토 버거 먹었어요 !! 기대했던 만큼 너무 맛있었고 👍🏻👍🏻👍🏻 특히 매쉬드 포테이토 존맛 ..제주도에서 왔다 하니 감튀 서비스까지 챙겨주셔서 정말 감사했습니다 ㅠㅠ 사장님이랑 직원 분 넘 친절하셔서 정말 기분 좋게 먹다 가요 !! 담에 또 홍대오면 들려야겠습니다 .. 홍대에서 햄버거 드신다면 갠적으로 스페이스원 버거 강추용 🔥
쨍하고해뜰날,42,622,4.5,2023.10.07.,5.0,서교동 스페이스원
동곰이,22,33,3.8,2023.10.07.,4.0,그냥 자리있길래 들어갔는데 가격도 합리적이고 버거 맛있었음! 근데 중앙쪽에 있는 테이블이 수평이 안맞는건지 너어무 덜컹덜컹 흔들리고 불편했음...ㅠㅜ 그치만 맛있는 버거였어 담에 또 가고싶음
바다를품은아이,10,19,4.2,2023.09.27.,4.0,각종 프렌차이즈버거및 수제버거 좋아해서 다양하게 먹어봤는데맛은 확실히 상위권입니다가격대비로 따지면 살짝 비싼편인거같지만 그래도 매쉬드포테이토버거는 유니크함이있네요!
크리스,6,3,1.0,2023.09.20.,1.0,포장인데 집 도착하고 보니 메뉴 구성품 하나 빠트리고 안 넣어주셨어요 빠트린 메뉴 땜에 시식에 영향이 크다고 전화 드렸더니 빠트린 메뉴비용만 환불해 주셨습니다 성의 없는 처리 방식 덕분에 안 좋은 시식 경험이었습니다  실수는 말로만 실수였다고 처리하면 성의 없다고 봅니다
강동현,2,1,5.0,2023.09.13.,5.0,수제버거도 맛있었는데 갈릭 감자 튀김이 정말 맛있었음
조진핑,33,166,2.3,2023.09.07.,5.0,가보려고 하는데 줄 많나요? 아무나 가보신분 평글로 남겨주세요
깅김,21,67,4.6,2023.09.04.,5.0,
후기미제공_가게는_거릅니다,74,"1,107",4.3,2023.09.01.,4.0,"수제버거 전문점.가격은 약간 높긴 했지만 가볍게, 맛있게 잘 먹었습니다.직접 조리하는 모습을 볼 수 있어서 좋았습니다."
앤쮸,73,681,3.5,2023.08.18.,5.0,"매쉬드 포테이토 버거,갈릭 프라이즈 세트주문했습니다. 우선 존맛탱이에요 매쉬드포테이토 버거는 어디가서 먹어본적없는 맛이었는데 양도푸짐하고 깔끔하고 좋았습니다. 갈릭 프라이즈 역시 참 맛있었어요 달콤한 갈릭소스가 입에서 순시 간에 사라지더군요 장사의신 보고 찾아갔는데 맛집을 발견해서 기쁩니다. 재방문의사 있습니다."
남택송,5,5,5.0,2023.08.13.,5.0,사장님도 친절 하시고 음식도 맛 납니다
뙈지,45,604,4.1,2023.07.23.,5.0,"매쉬드 포테이토 버거, 다른 곳에서는 볼 수 없는 특색있는 버거라서 좋았어요. 간이 쎄지 않고, 담백해요."
모논노네,18,29,4.0,2023.07.23.,3.0,버거 맛있어용내부공기가 시원한데 기름기가 있어서 찝찝한 느낌도 들어요
mina,6,8,3.6,2023.07.19.,1.0,월욜에 갔는데 문닫고  전화도 안받고..
ㅋㅋ,25,7,3.3,2023.07.09.,5.0,맛있게 잘먹었어요 사장님도 엄청 친절하세요
최승윤작가,18,29,4.0,2023.07.08.,5.0,맛은 진짜 최근 먹어본 버거 중에 제일 맛있었어요 이 가격 퀄리티가 아님. 사실 훨씬 비싼버거보다도 맛있어요. 치킨도 따로 치킨만 먹어도 될정도로 맛있어요.
유딘,9,10,4.9,2023.06.30.,5.0,햄버거랑 튀김 맛있고 엄청 친절하심 마싯게 잘먹었습니다
meme,5,5,5.0,2023.06.03.,5.0,맛있어요 강추!
큐큐,14,19,3.8,2023.05.31.,5.0,수제버거 좋아해서 찾아서 갔습니다. 너무 맛있게 먹었습니다👍
Hoster,26,197,4.0,2023.05.30.,5.0,
성동남,3,2,3.0,2023.05.29.,5.0,재방문의사 9999% 지인추천 무조건 해줄곳👍👍 혼밥 먹으러 왔는데 완전 친절하게대해주셨고 햄버거도 역시 갓입니다 ㅎㅎ 해외에 거주했던 사람이라 웬만한 햄버거에 놀라지 않는데 오랜만에 버거맛으로 놀라고 가네요!!!! 앞으로 더 대박 나시길 바랍니다 ㅎㅎ 잘먹고가요!!!
재환,3,2,3.5,2023.05.25.,4.0,맛있지만 가개가 좁습니드
ㅇㅅ,8,6,3.7,2023.05.20.,5.0,진짜 맛있어요!!!🥹 패티가 진짜... 말이 필요 없는 맛입니다
이재영,1,1,5.0,2023.05.08.,5.0,진짜 맛있습니다!다른 유명한곳이랑 견줘도 절대 밀리지 않아요!
WZ,31,121,3.8,2023.05.04.,4.0,테라스석 분위기...★
정진,6,9,3.7,2023.04.29.,5.0,수제버거 완전 러버로써 강추친절하고 깔끔하고 무엇보다 그냥 진짜 맛있음막 느끼하지도 않은데 수제버거스러움의 느낌함 정도만 챙김 치즈 프라이즈 레전드
정안희 (시계수리점 리워치),3,2,4.5,2023.04.25.,4.0,여기 맜있습니다. 다른 햄버거집과 다릅니다. ^^
석호,4,3,5.0,2023.04.18.,5.0,개존맛 특히 감자튀김은 지금까지 갔던 수제버거중에서 제일 맛있는듯
손춘식,6,11,4.6,2023.03.27.,5.0,갈릭버거 ㄹㅇ 쥰맛탱
🤫,2,7,3.9,2023.03.25.,5.0,
상맹,5,9,3.1,2023.03.19.,4.0,무난히 맛있네요~ 좀 비쌈 근데 ㅋ
칸탈로프,58,607,3.2,2023.03.10.,3.0,장사의 신 보고 방문했는데 버거가 좀 물리는 맛이네요콜라 없으면 먹기 힘듬
남택훈,3,1,5.0,2023.03.07.,5.0,인테리어도 맛도 깔끔함도 모두 최고였어요 !수제버거라고 하면 짜거나 기름진 기억밖에없는데 담백함과 다 적절하게 맛잇던거 같아요 꼭 가보세요 !
목동 물주먹,30,78,3.3,2023.03.05.,3.0,장사의 신보고 방문했습니다. 비쥬얼은 상당히 좋으나 맛은 그렇지 않습니다. 메쉬드포테이토 버거 - 비쥬얼은 좋으나 특색없음갈릭 버거 - 갈릭 맛이 좋고 살짝 바삭한 식감이 좋아 맛있음 다만 패티가 얇아 육즙이 거의 느껴지지않아 패티추가 필요(3000원) 칠리 감자튀김 - 그냥 감자튀김에 위에 칠리소스 그냥 그럼그냥 어쩌다 한번 먹기 좋습니다
두눈을감고 두귀를막고,33,182,3.4,2023.03.05.,3.0,"장사의 신 보고 감. 햄버거가 자고로 짭짤해야 하는데, 맛이 되게 안강렬해서 조금 실망. 되게 슴슴해서 막 느끼하다 물린다 그런 느낌은 전혀 안들지만  오히려 햄버거의 장점을 못살리는 느낌. 차라리 치즈 프라이가 맛있었다... 조금더 맛 디벨롭이 필요할 것으로 보임.."
Rmsl,2,2,5.0,2023.03.05.,5.0,사장님 너무 친절하고 맛있었어용!!
후기1개이력리뷰는 믿고거르세요,25,66,4.6,2023.03.04.,5.0,다시 찾아가서 먹고싶은 맛집!
맛도리,11,65,3.0,2023.03.02.,5.0,둘 다 맛있는데 개인적으로 매쉬드보다 베이컨이 더 맛있었어요 감자튀김은 안 된다고 하셔서 못 먹어봄
조현숙,31,173,3.3,2023.02.28.,5.0,"맛있네요, 한번 더 방문해서 먹고싶어요"
도붸르만,18,43,4.7,2023.02.27.,5.0,
곽득칠,44,219,4.5,2023.02.18.,5.0,매쉬드포테이토 버거 너무 맛있어요.감튀도 완전 취향대로 두껍고 바삭해서 넘조왔구번도 고소하니 맛있었어요 !! 숨겨진 맛집 !
말랑야로,21,41,4.3,2023.02.17.,5.0,진촤 마싯당. 목요일 6시반쯤 갓는데 사람 적당히 있어서 줄안서고 바로겟또함. 시그니처 2개 먹어봤는데 포테이토 어쩌고는 좀 슴슴해서 이유식에 마약탄느낌이고 베이컨 어쩌고는 진짜 신기한게 버거에서 마라탕냄새가 남 ㅋㅋㅋㅋㅋㅋ 이거는 마라탕에 마약탄느낌이었음 같이간 지인은 베이컨이 더 맛있다고 했고 나도 동감! 둘다 다른 매력이 있는 것 같음 가격은 단품 8800이엇다 존맛구리~
안드로메다,11,10,5.0,2023.02.07.,5.0,수제버거 특유의 느끼함도 없고 정말 맛있어요...! 매장도 깔끔해요!!
행복,28,79,4.3,2023.02.04.,5.0,다운타우너랑 뭔가 비슷하게 맛있음진짜 맛있다는뜻
어서옵,22,35,4.4,2023.02.03.,5.0,"매쉬드포테이토, 갈릭불고기, 미트칠리 모두 먹어봤어요. 빵이 고소하고 버터향도 잘 나고 적당히 빠삭하면서 참 맛있었어요. 패티도 부드럽고 다 매우 만족!! 사장님도 친절하시고 열심히 하시는 모습 응원합니다"
🧸메롱~🧸,18,27,2.3,2023.02.01.,5.0,확실히 다운타우너보다 맛있습니다. 다운타우너가 2등급 81점짜리 맛이고 여기는 1등급 94점정도네요.시그니처메뉴는 매쉬포테이토가 맞네요. 감튀도 다운타우너보다 더 맛있습니다.테이블옆이나 밑에 공간 만들어서 테블릿오더 및 결제까지 가능하게하면 좀 더 빨리 업무처리 가능할 것 같아요. 화장실안에 있어서 편하네요^^. 깔끔하고 죠아요~
프리지스,11,41,3.7,2023.02.01.,5.0,자리가 협소하고 불편함햄버거는 맛있음
내 리뷰보면 실패안함,36,260,3.7,2023.01.31.,3.0,"장사의신보고감직원들이 굉장히 미숙함내가 알바해주고 싶었음가게문이 잘안닫혀서 매장안이 추움음식 나오는데 오래걸림매쉬드 포테이토, 미트칠리 먹었는데 버거맛도 그저그럼재방 안할듯"
wwww,6,28,4.1,2023.01.30.,5.0,
효짱,11,13,2.6,2023.01.29.,4.0,맛은 ♪♬♪ 맛있는데 추운날 사람 줄세우는게 참 짜증남 ㅋ̄̈홀이 굉장히 협소하고 대기시스템이 개판 테이블링을하던지 하는게좋을듯기다리는사람많으면 추운데 가게 바로앞에서 기다린사람부터 그냥 바로 입장시켜주는게 맞다고생각함.첫번째방문 밖에서는 오들오들 떨면서 기다리는데 미리온사람 5분 기다려주느라 테이블 3개나 놀고있는데 못들어감..주말에 한번 더 방문햇는데 브레이크타임17시 이후17:40이됏는데도 한테이블도 버거 못받고 난 밖에서 대기하다가 밖에서 한시간 더 기다려야할것같아서 그냥 나옴..평일에 가는게 좋을듯하고 햄버거면 햄버거답게 좀 빨리 빨리 나오던가 하면좋을듯대기하는분들에게 어느정도 기다려야한다 뭐 어떻게 진행중인상황이다 이런것좀 알려주면 기다리겠는데 입구도 정말 협소하고 아무 진행상황도 모른채 그냥 영하 10도에서 기다리려니 추워서 짜증이 엄청난 가게. 현장이형 빨리와서 좀 중간점검좀 해줬으면..맛은 ♪♬♪맛있음 진짜 다운타우너 빰 후려갈김나만 먹고싶은맛 사장님 쫌 대처좀 해주새요 제발다음날 먹고싶어서 또감 사장님한테 말하니 번호표도 준비중이라고 정중하게 말하심. 별점 4점!.편하게 기다려서 먹게되면 5점! 줄것..
서영재,3,3,5.0,2023.01.27.,5.0,바로 근처에서 일하고 있어서 몇일 전 다녀왔는데 오늘 까지도 생각나는 맛입니다. 사장님이너무 친절하셔서 픽업해오는데 기분까지 좋아지네요^^ 한번 드셔보시는 걸 적극 추천합니다!!
Citrus,10,12,4.7,2023.01.26.,5.0,수제버거 핵꿀맛
Sangyoub,13,27,3.7,2023.01.24.,5.0,"매쉬드포테이토 버거를 못먹어서 아쉬웠지만, 너무 만족해서 포장으로 하나 더 사갑니다. 감튀도 좋았어요. 사장님 및 직원분들도 친절하시고 동네 주민으로서 자주 올 것 같습니다."
승찬리,11,15,5.0,2023.01.21.,5.0,
하하,27,100,2.4,2023.01.21.,1.0,큰맘먹고 멀리서왔는데 독감이라뇨.. 영업중으로 뜨는데..
 James,34,179,3.5,2023.01.21.,5.0,일단 와드부터 박음
코릴라,26,62,3.0,2023.01.20.,4.0,장사의신 보고 잘됐으면 하는 바람에서 다녀왔습니다매쉬드포테이토는 기대한것 만큼의 맛이 아니었던것이 조금 아쉬웠으나 패티랑 빵이 맛있었고 갈릭버거랑 갈릭프라이즈는 맛있었습니다가격생각하면 모두 괜찮은 맛이었습니다다만 급격하게 손님이 늘어나서 그런지 아직 시스템 정착되지않아 우왕좌왕하시는 느낌이있었으나 열심히 친절하게 손님 맞이해주시는 모습이 보기 좋았습니다다음에 다른버거도 먹어보고 싶네요
꺼억,8,10,5.0,2023.01.20.,5.0,"꺼어억, 화장실 깔끔"
김영종,2,2,4.5,2023.01.19.,5.0,
BTstx,5,5,3.2,2023.01.19.,4.0,햄버거 맛있게 먹었어요.좋은 재료로 만드신게 느껴져요.아쉬운점은 감자튀김인데 조금 더 통통하게바삭하게 하면 좋을 듯 합니다.감자가 살짝 아쉬웠네요
Bangg,22,95,3.7,2023.01.17.,5.0,
코리안,4,4,3.8,2023.01.17.,5.0,진심..인생버거
돌멩이,46,334,4.1,2023.01.17.,5.0,와... 뭐 말이 더 필요한가
형준,6,12,5.0,2023.01.16.,5.0,
빅토리,21,118,2.2,2023.01.16.,5.0,굿굿베리굿굿따봉원츄
T,12,18,3.6,2023.01.16.,5.0,맛잇ㅇ서요
이기현,6,10,2.2,2023.01.16.,5.0,
⭐️,16,26,4.1,2023.01.16.,5.0,힘내요!
let,11,32,3.2,2023.01.15.,5.0,장신 ㅋ
jun,18,42,3.7,2023.01.15.,5.0,줄이 얼마나 서있을까...몽말인지 알지?
Chris,16,43,2.5,2023.01.15.,5.0,초심잃지마시길
보리건빵,15,19,2.2,2023.01.15.,5.0,
음식가지고장난하지마라,32,100,3.2,2023.01.15.,5.0,아 여기 이제 줄 서겠네 큰일났다
c.h,18,42,4.7,2023.01.15.,5.0,장사의신 맛집!!
송파팜스,6,10,4.6,2023.01.15.,5.0,
맛잘알,18,31,4.0,2023.01.15.,5.0,회사앞 쉑쉑에서 먹는 무미건조함과는질적으로 다른 맛... 체인점인지 몰겠는데 여기저기 많이생겼음좋겠다 ㅠ
조얀,3,2,5.0,2022.12.24.,5.0,가장 기본적인 베이컨 치즈버거를 먹었는데 고소한 번부터 담백한 패티까지 너무 맛있었습니다. 사이드로 시킨 갈릭프라이도 존맛탱.... ㅠㅠ 화장실도 깔끔해서 좋았습니다~!
Rone,21,35,4.5,2022.11.15.,5.0,치즈버거랑 갈릭 불고기 버거 정말 맛있게 먹었습니다~!분위기 또한 너무 스타워즈 처럼 너무 신선해요 ㅎㅎ
김명수,2,1,5.0,2022.11.04.,5.0,지나가다가 들어가봤는데 겁나 맛있네요 ㄷㄷ
고양이여름이,2,1,5.0,2022.11.04.,5.0,속 재료가 빵빵하고 신선해서 좋았어요.매장도 깨끗하고 친절하고 특히 화장실이 깨끗해서 좋았어요.
앙꼬이모,3,1,5.0,2022.10.30.,5.0,인테리어 힙하고 귀여워서 들어갔는데 생각보다 맛있어서 담에 또 갈 듯이요 번이 겉바속촉이고 맛집찾기 어려운 홍대서 맛잇게 먹기 좋은 수제버거에요! 특히 미트칠리 포테이토랑 같이 먹으면 느끼한 거 없이 존맛탱으로 먹을 수 있어요!
