user_name,user_rank,num_response,user_star,time,rating,content
박대규,2,1,5.0,2023.09.24.,5.0,데이트코스 친목모임 육회 새우 살치살 무조건 가보세욤😁😁😁
아리스토탤래뱅킹,30,117,4.4,2023.07.08.,5.0,"분위기도 좋고, 직원분들도 친절하고~고기도 맛있었습니다"
박진희,2,3,3.7,2024.03.13.,3.0,
피자,31,126,3.4,2023.11.01.,5.0,잘먹게씁니다 등심 폼 미쳐따이!인스타에서 포니 보고 나중에 가보려구요
언제나청춘,41,564,4.7,2023.10.08.,5.0,홍대에서 고기를 구워주는 소고기 맛집
이가연,2,1,5.0,2023.08.15.,5.0,고기도 모두 구워주시고 맛있게 먹었습니다다음에 또 방문하고 싶어요 🩶🍀
김철우입니다,3,26,4.6,2023.08.03.,5.0,
오리,27,61,3.8,2023.07.14.,4.0,"가격에 비해 g수가 부족함… 비싸다는거져…그리고 남자직원이 고기 구워주긴 하는데 미디움으로 돼서 아쉬움. 미디움 레어 라고 하셨지만.. 먹으면 미디움 식감..추천세트+제비추리+하우스와인2잔 주문 했는데, 하우스와인2잔은 말하니까 나옴. 주문 잊어버린거지 ㅎㅎ……된장밥까지 다 먹으니까 1시간 딱 걸림 ㅋㅋㅋㅋ"
다복솔,12,30,4.6,2023.06.27.,4.0,
강창도,25,91,4.6,2022.10.10.,1.0,가격대비 양이 너무 심각하게 적습니다.. 이건아니에요
빵빵,5,13,4.1,2022.08.11.,5.0,
마싓숴,4,3,3.7,2022.03.11.,5.0,ㅇㄷㅌ님 덕분에 오늘 너무 즐겁고 맛있게 먹다 갑니다!!고기가 맛있는건 당연한거고 고기 구워주시는 ㅇㄷㅌ님 께서너무 친절하게 설명해주시고 정말 맛있게 구워주셨습니다 직원분 월급 2배로 받으셔야할듯왜냐면 제가 재방문하면 음식이 맛있어서가 아니라 직원분 덕분이거든여!! 성함 쓰면 곤란해하실까봐 초성으로..ㅎㅎ 원래 고기 구워주는 집 가면 친구들끼리 대화하기에 어색하기도 하고 눈치가 보이기도하는데 진짜 너모너모 말모말모 담에 또 갈게요 건강하세요!!!
rkd,14,23,4.5,2022.02.19.,5.0,너무 맛있고 기분좋게 먹고 갑니다. 신경써주신 직원분들 감사합니다.
윤쌤,11,23,1.9,2022.01.11.,1.0,그냥 가격대비 별로
시절인연,28,95,3.6,2021.11.23.,4.0,고기 잘 구워주시고 고기맛도 괜춘해요 매장이 좁아서 씨끄러운 분위기임
ㅘ,5,7,4.7,2021.09.16.,4.0,맛은 있는데 사실 가격대가 조금 부담이 되긴해요ㅜㅜ자주 들리기는 힘들겠지만 기념일같은 날 방문하긴 좋을 것 같아요!
normal,23,76,3.9,2021.08.08.,5.0,그날의 추천메뉴와 상관없이 제일 비싼 게 제일 맛있음 안심은 2인분 이상 시켜야함에도 가장자리에서 식어갈수록 퍽퍽해서 별로고 새우살이 역시 살살 녹아요 자리도 널찍해서 깔끔하고 다 구워줘서 역시 고기는 이런 데가 편한듯. 특별한 자리나 대접할 일 있을 때 추천합니다.
abc,3,5,5.0,2021.07.24.,5.0,맛있구 넘 친절하심!! 재방문 의사 100이에용
쏘냐도르,43,362,4.3,2021.05.30.,5.0,맛: 여러 부위를 취급하는데 모두 빠짐없이 다양하게 맛있고 육질이 정말 좋습니다. 소고기 잘 모르는 소알못이지만 혀에 닿는 순간 좋은 고기구나 알 수 있어요서비스: 남자직원분인지 사장님이신지 직접 구워주셨는데 친절하셨음인테리어: 평범기타: 특별한날 좋은 소고기 먹어야겠다 싶을때 유력한 후보지
맛대맛,12,36,3.3,2021.02.14.,4.0,
,2,1,5.0,2021.02.11.,5.0,비싼값을 하네요 따봉 두개 드립니다.
북북이,36,244,4.3,2020.11.08.,2.0,소고기라 가격대가 있네요.
DAAS,23,97,4.1,2020.10.15.,5.0,너무 맛있습니다 예약하고 갈 수 있어서 좋습니다 자주 방문하게 되는 곳이네요
sssa,3,2,5.0,2020.01.09.,5.0,가격대가 있어서 큰 맘 먹고 갔는데 완전 만족했어요 !!고기 질도 좋고 맛있고 ㅠㅠ 직접 구워주시기도하고 서비스도 좋았어요! 여러모로 만족했습니당 :)
정연,2,1,5.0,2020.01.06.,5.0,남자친구랑 먹으러 갔는데 서비스도 너무좋고 고기도 너무 맛있어서 다음에 또 예약하고 가려구요!!:)
미리,1,1,5.0,2019.11.02.,5.0,너무 맛있게 잘 먹었습니다직원분들도 다 친절하셔서 기분 좋게 먹고 왔어요 !
강지민,2,1,5.0,2019.09.25.,5.0,저번에 갔을때는 만석이여서 조금 기다렸는데 도착 20분 전이라도 미리 예약하고 가니 바로 앉을 수 있어서 좋았어요. 고기..진짜 맛잇습니다 ㅠㅠ 최근에 먹엇던 소고기중에 최고엿어요. 입에 넣는 순간 구수한 육즙이 터지고 조금 느끼하다 싶을때 준비해주신 반찬과 함께 먹으면 질리지 않게 계속 먹게되더라구요. 확실히 이 집의 매력은 좋은 숯에 질 좋은 고기에요. 술 종류가 다양한것도 좋았어요. 와인 추천해달라고 하니 친절하게 추천도 해주셨구요. 아주 편안한 분위기에서 대접받는 느낌으로 식사하고 왔습니다. 가격대가 조금 있는편인건 사실이지만 그만큼의 값어치를 하는 것 같습니다 !
김태훈,2,2,3.0,2019.09.16.,5.0,너무 맛있었어요!! 분위기도 마음에들고 좋았어요 다시 방문할꺼같습니다!!
pig,27,212,3.4,2019.08.16.,2.0,"일단 가격이 너무 비쌉니다. 직장인들 밀집한 강남/광화문보다도 비싸요. 근데 그 가격에 만족스러운 서비스를 받느냐, 그것도 아닙니다. 제가 간 날은 고기를 구워주지도 않았습니다. 내부 공간도 대학가 삼겹살집 느낌이라 특별이 아늑하거나 분위기 있지도 않아요."
배대웅,3,2,5.0,2019.03.17.,5.0,고기가 너무 맛있어요!! 직원들도 친절하고분위기도 맘에 들어서 또 방문할 예정이에요
박건호,1,1,5.0,2019.03.15.,5.0,고기가 확실히 다른집이랑은 다르네요~~ 맛있게잘먹었습니다 ㅎㅎ
뇸뇸,11,14,3.9,2019.02.22.,3.0,락교 맛집...
Bigmama,34,132,4.0,2018.02.13.,1.0,와.... 돈 많을 때 와야겠네. 넘 비싸고 양도 적어서.
레더맨,20,40,1.5,2018.01.20.,5.0,여기가 카광이란 별명을 쓰는 만화가가 업진살 인증을 했던 식당입니까?
박진선,8,24,4.1,2017.04.01.,5.0,"절친, 연인과 조용하게 등심과 와인 즐기기 좋아요."
강동길,33,452,3.1,2016.08.13.,2.0,딱 세번갔다
몽모리,8,289,3.0,2016.04.10.,3.0,
